{
  "kind": "dossier",
  "schema_version": "1.1.0",
  "id": "GRADER-AFTER",
  "record_status": "EXAMPLE",
  "example_class": "ILLUSTRATIVE_SCENARIO",
  "title": "PathJudge / corrected evaluator",
  "subtitle": "The product is unchanged. A qualified assignment amendment can improve the judgment without improving the code.",
  "purpose": "Distinguish behaviorally correct output from incidental filename choices that the consumer does not require.",
  "boundary": "The same fictional output-producing component under two illustrative evaluator epochs.",
  "beneficiary": "A consumer reading records via the public return path, not by a hard-coded grader filename.",
  "authorship": "AGENT_ORIGINATED",
  "intent_status": "Accepted for a bounded experiment within the fictional scenario; not an actual portfolio commitment.",
  "genesis_rationale": "This fictional repository was created by agents to isolate a consumer-facing capability. Its boundary is a hypothesis, not proof that a separate repository is necessary.",
  "alternatives": [
    "Keep the output filename requirement only if a real consumer depends on it",
    "Correct the grader to validate the public behavior",
    "Revise the public contract in a new epoch",
    "Do not change the product"
  ],
  "authority": "Illustrative delegated mandate only. No actual device, repository, deployment, financial, or lifecycle authority is granted by this example.",
  "non_goals": [
    "Claim real-repository completion",
    "Require a human-authored repository idea",
    "Wait for a central registry to become operational"
  ],
  "subject_identity": {
    "source_revision": null,
    "identity_method": "PEP value digest of subject.json (an authored scenario descriptor), not a Git commit or runtime artifact.",
    "limitation": "No source checkout, real product execution, or real user observations were collected for this illustrative case."
  },
  "inventory": [
    {
      "id": "INV-01",
      "item": "Product output",
      "declared": "Returns required records",
      "observed_or_assumed": "Correct contents assumed in both epochs",
      "gap": "No product delta",
      "evidence_basis": "Authored scenario premise, not a collected product observation."
    },
    {
      "id": "INV-02",
      "item": "Filename rule",
      "declared": "Not required by consumer",
      "observed_or_assumed": "Grader uses supported return path",
      "gap": "Evaluator correction, not feature implementation",
      "evidence_basis": "Authored scenario premise, not a collected product observation."
    },
    {
      "id": "INV-03",
      "item": "Historical reports",
      "declared": "Immutable old judgment",
      "observed_or_assumed": "Old epoch retained",
      "gap": "No retroactive replacement",
      "evidence_basis": "Authored scenario premise, not a collected product observation."
    }
  ],
  "maturity": {
    "scenario_or_scoped_label": "Illustrative: behavioral gate passes; no product-change credit.",
    "claim_limit": "Illustrative stage interpretation only. The current evidence-backed result is not a real-product maturity finding.",
    "axes": [
      {
        "axis": "PRODUCT_BEHAVIOR",
        "status": "ILLUSTRATIVE PASS — same premise",
        "basis": "No product source changed."
      },
      {
        "axis": "ASSIGNMENT_QUALIFICATION",
        "status": "ILLUSTRATIVE PASS",
        "basis": "Valid non-identical witness distinguishes grader error."
      },
      {
        "axis": "ACTUAL_PRODUCT_EVIDENCE",
        "status": "NOT_EVALUATED",
        "basis": "This is an authored scenario, not a live grader run."
      }
    ],
    "value_evidence": "No actual consumer value evidence is included. The case distinguishes a plausible intent from a validated benefit."
  },
  "finding_ids": [],
  "decision_ids": [
    "DEC-NEXT"
  ],
  "semantic_reviews": [
    {
      "topic": "Does this assignment serve the parent outcome?",
      "assessment": "Judge the named consumer outcome rather than the existence of infrastructure or the size of the repository.",
      "support": "The fictional scenario names a bounded consumer and a failure that would prevent its outcome.",
      "countercase": "The same outcome may be served more cheaply by an existing owner, a smaller feature, or no new product.",
      "discriminator": "Execute the smallest real consumer journey under the same success and failure conditions.",
      "confidence_basis": "Reasoned interpretation of the supplied fictional premises; no empirical product confidence is claimed."
    }
  ],
  "next_action": "Preserve both epochs and classify the delta as evaluator correction, not implementation improvement.",
  "stop_condition": "Stop repeated implementation retries when a valid witness falsifies the grader assumption.",
  "restart_packet": {
    "accepted_baseline": "Use this fixture as an example only; establish a real pinned subject and assignment before operational work.",
    "failed_hypotheses": [
      "The only valid implementation must write output.json.",
      "A fresh session alone repairs a logically wrong test."
    ],
    "next_reproduction": "Translate the scenario into a bounded authorized real-product experiment, then replace fictional premises with collected observations.",
    "budget_and_permissions": "No product mutation or external actions authorized by this package. Carry forward the actual cumulative budget and permissions from the operating mandate."
  },
  "lineage": {
    "previous_dossier_id": "GRADER-BEFORE",
    "change_class": "EVALUATOR_CORRECTION",
    "description": "Subject descriptor digest is identical across the two dossiers. Assignment bytes, epoch, and proposed evaluator interpretation change; no actual product code was modified."
  },
  "provenance_notice": "Fictional worked example. Every purported product outcome below is an authored premise. Result records remain PROPOSED and instrument qualifications are absent, so the real evidence reducer grants no acceptance credit.",
  "row_notes": [
    {
      "instance_id": "I-01",
      "title": "The core operation produces the required result for a representative valid input",
      "interpretation": "The scenario product produces the correct set of output records.",
      "next_action": "Collect the actual product evidence before accepting this claim."
    },
    {
      "instance_id": "I-02",
      "title": "The grader accepts a valid solution that differs from its reference implementation",
      "interpretation": "A valid implementation using a different output filename is accepted.",
      "next_action": "Qualify filename-independent semantic equivalence against the accepted outcome."
    },
    {
      "instance_id": "I-03",
      "title": "The grader rejects an empty or no-op implementation for nonempty behavior",
      "interpretation": "The grader still rejects empty/no-op output.",
      "next_action": "Collect the actual product evidence before accepting this claim."
    },
    {
      "instance_id": "I-04",
      "title": "The oracle's expected result has a justification outside the candidate output alone",
      "interpretation": "Expected records come from the accepted consumer contract rather than copying candidate output.",
      "next_action": "Collect the actual product evidence before accepting this claim."
    },
    {
      "instance_id": "I-05",
      "title": "Known grader limitations constrain the claims it may support",
      "interpretation": "The evaluator scope excludes arbitrary filename requirements not in the consumer contract.",
      "next_action": "Collect the actual product evidence before accepting this claim."
    },
    {
      "instance_id": "I-06",
      "title": "A grader update has its own version and qualification record",
      "interpretation": "The corrected evaluator has a new declared version with its own qualification procedure.",
      "next_action": "Collect the actual product evidence before accepting this claim."
    },
    {
      "instance_id": "I-07",
      "title": "Changing a grader creates an attributable evaluator revision",
      "interpretation": "Evaluator changes are attributed to a new epoch.",
      "next_action": "Collect the actual product evidence before accepting this claim."
    },
    {
      "instance_id": "I-08",
      "title": "A corrected oracle does not retroactively rewrite the old product verdict",
      "interpretation": "The previous report remains preserved; it is not rewritten as a product success.",
      "next_action": "Collect the actual product evidence before accepting this claim."
    },
    {
      "instance_id": "I-09",
      "title": "A repeated failure signature is retained across sessions",
      "interpretation": "Repeated failure fingerprints identify the same incidental filename assertion.",
      "next_action": "Collect the actual product evidence before accepting this claim."
    },
    {
      "instance_id": "I-10",
      "title": "Restart, replay, reseed, replan and contract revision are separately recorded",
      "interpretation": "Restarting a context is distinguished from correcting the contract.",
      "next_action": "Collect the actual product evidence before accepting this claim."
    },
    {
      "instance_id": "I-11",
      "title": "A next action targets a discriminating observation rather than identical unbounded retries",
      "interpretation": "A valid non-identical witness is the next discriminating experiment, not another identical patch.",
      "next_action": "Collect the actual product evidence before accepting this claim."
    }
  ]
}
